{
  "$schema": "../../schemas/rolex-price-history.schema.json",
  "schemaVersion": 1,
  "marketCode": "DE",
  "currencyCode": "EUR",
  "priceType": "tax-include",
  "taxRatePercent": 19,
  "collectionRuns": [
    {
      "runId": 1,
      "collectedAt": "2026-09-01T12:25:18+02:00",
      "recordCount": 1465
    }
  ],
  "priceSeries": {
    "m127334-0001": [
      {
        "runId": 1,
        "listingStatus": "listed",
        "price": 15850
      }
    ],
    "m228236-0018": [
      {
        "runId": 1,
        "listingStatus": "listed",
        "price": 66300
      }
    ],
    "m336935-0008": [
      {
        "runId": 1,
        "listingStatus": "listed",
        "price": 62600
      }
    ],
    "m279173-0007": [
      {
        "runId": 1,
        "listingStatus": "listed",
        "price": 14550
      }
    ],
    "m126334-0033": [
      {
        "runId": 1,
        "listingStatus": "listed",
        "price": 11250
      }
    ],
    "m134303-0001": [
      {
        "runId": 1,
        "listingStatus": "listed",
        "price": 9300
      }
    ],
    "m126506-0001": [
      {
        "runId": 1,
        "listingStatus": "listed",
        "price": 81500
      }
    ],
    "m126613lb-0002": [
      {
        "runId": 1,
        "listingStatus": "listed",
        "price": 18700
      }
    ],
    "m126603-0001": [
      {
        "runId": 1,
        "listingStatus": "listed",
        "price": 21650
      }
    ],
    "m136660-0005": [
      {
        "runId": 1,
        "listingStatus": "listed",
        "price": 15220
      }
    ],
    "m126710blnr-0003": [
      {
        "runId": 1,
        "listingStatus": "listed",
        "price": 11350
      }
    ],
    "m226658-0001": [
      {
        "runId": 1,
        "listingStatus": "listed",
        "price": 36700
      }
    ],
    "m126680-0001": [
      {
        "runId": 1,
        "listingStatus": "listed",
        "price": 19500
      }
    ],
    "m224270-0001": [
      {
        "runId": 1,
        "listingStatus": "listed",
        "price": 8050
      }
    ],
    "m226570-0001": [
      {
        "runId": 1,
        "listingStatus": "listed",
        "price": 10250
      }
    ],
    "m126900-0001": [
      {
        "runId": 1,
        "listingStatus": "listed",
        "price": 7850
      }
    ],
    "m52508-0008": [
      {
        "runId": 1,
        "listingStatus": "listed",
        "price": 39500
      }
    ],
    "m126000-0016": [
      {
        "runId": 1,
        "listingStatus": "listed",
        "price": 6450
      }
    ],
    "m127336-0001": [
      {
        "runId": 1,
        "listingStatus": "listed",
        "price": 65900
      }
    ],
    "m126500ln-0001": [
      {
        "runId": 1,
        "listingStatus": "listed",
        "price": 16200
      }
    ],
    "m126000-0014": [
      {
        "runId": 1,
        "listingStatus": "listed",
        "price": 6450
      }
    ],
    "m126710grnr-0003": [
      {
        "runId": 1,
        "listingStatus": "listed",
        "price": 11550
      }
    ],
    "m52506-0003": [
      {
        "runId": 1,
        "listingStatus": "listed",
        "price": 32400
      }
    ],
    "m52509-0002": [
      {
        "runId": 1,
        "listingStatus": "listed",
        "price": 29200
      }
    ],
    "m126505-0005": [
      {
        "runId": 1,
        "listingStatus": "listed",
        "price": 57100
      }
    ],
    "m228239-0033": [
      {
        "runId": 1,
        "listingStatus": "listed",
        "price": 52200
      }
    ],
    "m136668lb-0001": [
      {
        "runId": 1,
        "listingStatus": "listed",
        "price": 65600
      }
    ],
    "m126610ln-0001": [
      {
        "runId": 1,
        "listingStatus": "listed",
        "price": 10950
      }
    ],
    "m276208-0002": [
      {
        "runId": 1,
        "listingStatus": "listed",
        "price": 30450
      }
    ],
    "m126203-0058": [
      {
        "runId": 1,
        "listingStatus": "listed",
        "price": 14500
      }
    ],
    "m228238-0042": [
      {
        "runId": 1,
        "listingStatus": "listed",
        "price": 48600
      }
    ],
    "m127286tbr-0001": [
      {
        "runId": 1,
        "listingStatus": "listed",
        "price": 98450
      }
    ],
    "m126515ln-0006": [
      {
        "runId": 1,
        "listingStatus": "listed",
        "price": 43200
      }
    ],
    "m124205-0002": [
      {
        "runId": 1,
        "listingStatus": "listed",
        "price": 38550
      }
    ],
    "m126622-0001": [
      {
        "runId": 1,
        "listingStatus": "listed",
        "price": 12700
      }
    ],
    "m268621-0003": [
      {
        "runId": 1,
        "listingStatus": "listed",
        "price": 17150
      }
    ],
    "m226659-0002": [
      {
        "runId": 1,
        "listingStatus": "listed",
        "price": 38500
      }
    ],
    "m126610lv-0002": [
      {
        "runId": 1,
        "listingStatus": "listed",
        "price": 11500
      }
    ],
    "m126333-0010": [
      {
        "runId": 1,
        "listingStatus": "listed",
        "price": 17050
      }
    ],
    "m279135rbr-0001": [
      {
        "runId": 1,
        "listingStatus": "listed",
        "price": 52250
      }
    ],
    "m126284rbr-0011": [
      {
        "runId": 1,
        "listingStatus": "listed",
        "price": 20350
      }
    ],
    "m126715chnr-0002": [
      {
        "runId": 1,
        "listingStatus": "listed",
        "price": 55550
      }
    ],
    "m278241-0018": [
      {
        "runId": 1,
        "listingStatus": "listed",
        "price": 13700
      }
    ],
    "m226627-0001": [
      {
        "runId": 1,
        "listingStatus": "listed",
        "price": 15450
      }
    ],
    "m336934-0001": [
      {
        "runId": 1,
        "listingStatus": "listed",
        "price": 17100
      }
    ],
    "m228238-0069": [
      {
        "runId": 1,
        "listingStatus": "listed",
        "price": 48600
      }
    ],
    "m126718grnr-0001": [
      {
        "runId": 1,
        "listingStatus": "listed",
        "price": 49000
      }
    ],
    "m336239-0002": [
      {
        "runId": 1,
        "listingStatus": "listed",
        "price": 51500
      }
    ],
    "m126688-0001": [
      {
        "runId": 1,
        "listingStatus": "listed",
        "price": 58500
      }
    ],
    "m126300-0029": [
      {
        "runId": 1,
        "listingStatus": "listed",
        "price": 8600
      }
    ],
    "m127335-0001": [
      {
        "runId": 1,
        "listingStatus": "listed",
        "price": 52200
      }
    ],
    "m128236-0018": [
      {
        "runId": 1,
        "listingStatus": "listed",
        "price": 61800
      }
    ],
    "m124060-0001": [
      {
        "runId": 1,
        "listingStatus": "listed",
        "price": 9750
      }
    ],
    "m126234-0051": [
      {
        "runId": 1,
        "listingStatus": "listed",
        "price": 9750
      }
    ],
    "m126509-0001": [
      {
        "runId": 1,
        "listingStatus": "listed",
        "price": 57100
      }
    ],
    "m279171-0028": [
      {
        "runId": 1,
        "listingStatus": "listed",
        "price": 14850
      }
    ],
    "m126711chnr-0002": [
      {
        "runId": 1,
        "listingStatus": "listed",
        "price": 19350
      }
    ],
    "m126508-0008": [
      {
        "runId": 1,
        "listingStatus": "listed",
        "price": 53200
      }
    ],
    "m126720vtnr-0001": [
      {
        "runId": 1,
        "listingStatus": "listed",
        "price": 11850
      }
    ],
    "m126518ln-0004": [
      {
        "runId": 1,
        "listingStatus": "listed",
        "price": 41100
      }
    ],
    "m124200-0007": [
      {
        "runId": 1,
        "listingStatus": "listed",
        "price": 6150
      }
    ],
    "m126613ln-0002": [
      {
        "runId": 1,
        "listingStatus": "listed",
        "price": 18700
      }
    ],
    "m126234-0071": [
      {
        "runId": 1,
        "listingStatus": "listed",
        "price": 12300
      }
    ],
    "m128235-0009": [
      {
        "runId": 1,
        "listingStatus": "listed",
        "price": 50900
      }
    ],
    "m278274-0018": [
      {
        "runId": 1,
        "listingStatus": "listed",
        "price": 9250
      }
    ],
    "m126713grnr-0001": [
      {
        "runId": 1,
        "listingStatus": "listed",
        "price": 19650
      }
    ],
    "m128399tbr-0029": [
      {
        "runId": 1,
        "listingStatus": "listed",
        "price": 99550
      }
    ],
    "m126600-0002": [
      {
        "runId": 1,
        "listingStatus": "listed",
        "price": 13950
      }
    ],
    "m126655-0002": [
      {
        "runId": 1,
        "listingStatus": "listed",
        "price": 36300
      }
    ],
    "m126503-0001": [
      {
        "runId": 1,
        "listingStatus": "listed",
        "price": 23650
      }
    ],
    "m126333-0019": [
      {
        "runId": 1,
        "listingStatus": "listed",
        "price": 16300
      }
    ],
    "m279160-0013": [
      {
        "runId": 1,
        "listingStatus": "listed",
        "price": 7550
      }
    ],
    "m127285tbr-0002": [
      {
        "runId": 1,
        "listingStatus": "listed",
        "price": 99950
      }
    ],
    "m336933-0001": [
      {
        "runId": 1,
        "listingStatus": "listed",
        "price": 23200
      }
    ],
    "m126331-0007": [
      {
        "runId": 1,
        "listingStatus": "listed",
        "price": 18900
      }
    ],
    "m126067-0002": [
      {
        "runId": 1,
        "listingStatus": "listed",
        "price": 28000
      }
    ],
    "m276200-0009": [
      {
        "runId": 1,
        "listingStatus": "listed",
        "price": 5950
      }
    ],
    "m124270-0001": [
      {
        "runId": 1,
        "listingStatus": "listed",
        "price": 7650
      }
    ],
    "m228235-0055": [